{"$schema":"https://json-schema.org/draft/2020-12/schema","$id":"https://abvx.invalid/schemas/bakeoff-decision/v1","title":"ABVX Bakeoff Decision","type":"object","additionalProperties":false,"required":["schema_version","bakeoff_id","role","baseline","candidate","decision","decision_state","raw_evidence_refs","recommendation"],"properties":{"schema_version":{"const":"v1"},"bakeoff_id":{"type":"string"},"role":{"type":"string"},"baseline":{"type":"string"},"candidate":{"type":"string"},"decision":{"enum":["ADOPT","CONDITIONAL_ADOPT","REJECT","INCONCLUSIVE"]},"decision_state":{"const":"STOP_FOR_HUMAN_DECISION"},"raw_evidence_refs":{"type":"array","items":{"type":"string"}},"recommendation":{"type":"string"},"measured_differences":{"type":"object","additionalProperties":true},"qualitative_assessment":{"type":"object","additionalProperties":true},"loopx_owns":{"type":"array","items":{"type":"string"}},"loopx_must_not_own":{"type":"array","items":{"type":"string"}},"retained_patterns":{"type":"array","items":{"type":"string"}},"risks":{"type":"array","items":{"type":"string"}},"unresolved_questions":{"type":"array","items":{"type":"string"}}}}
