{"schema_version":"v1","bakeoff_id":"mission-control-001","role":"long-running development mission/control-state layer","baseline":"native fixture-specific atomic JSON checkpoint","candidate":"huangruiteng/loopx@ec48bd0","decision":"CONDITIONAL_ADOPT","decision_state":"STOP_FOR_HUMAN_DECISION","raw_evidence_refs":["runs/20260808T125949520017Z/mission-control-native.stdout","runs/20260808T125949520017Z/mission-control-loopx.stdout","runs/20260808T125949520017Z/mission-control-native.evidence.json","runs/20260808T125949520017Z/mission-control-loopx.evidence.json"],"recommendation":"Do not integrate yet. Seek human approval only for an optional, pinned, development-mission control-state evaluation after integrity and alternate-provider follow-up checks.","measured_differences":{"native_duration_ms":1703,"loopx_duration_ms":40425,"native_result":"PASS","loopx_result":"INCONCLUSIVE","native_runtime_dependencies":0,"loopx_runtime_dependencies":0,"loopx_python_files_observed":703,"loopx_python_loc_observed":315463,"loopx_upstream_head":"ec48bd0052470d32da32517f7d4506f9d03fa2e9"},"qualitative_assessment":{"problem_loopx_solves":"Reusable provider-neutral durable goals, todos, gates, quota, evidence and handoff state across development sessions; the native fixture is intentionally not reusable.","frequency_for_abvx":"Material for multi-day development, research and experiment missions; unnecessary for short bounded tasks.","less_infrastructure_alternative":"A narrow ABVX-owned state contract could cover the tested scenario with materially less surface, but would require ABVX to build and maintain the missing reusable semantics.","operational_complexity":"LoopX increases setup, startup latency, state surfaces, version coupling and inspection burden, while reducing bespoke mission-state code.","provider_portability":"The upstream surface is provider-neutral by design, but this fixture did not execute Codex, Prime Agent, or another real execution provider.","scope_temptation":"Its scheduler, heartbeat, claims, leases, projections and domain capabilities could tempt ABVX-OS to use it as a general workflow engine; that is explicitly out of scope."},"loopx_owns":["optional development mission/control-state persistence","mission-scoped todos, gates, quota metadata, evidence and handoff projection"],"loopx_must_not_own":["ABVX canonical identity and registries","portfolio prioritization","Personal Cortex or project strategy","execution providers","Universal Inbox, media, revenue or support workflows","production authorization or external writes"],"retained_patterns":["explicit human gates","quota checked before continuation","evidence-backed handoff","provider-neutral state boundary","read-first inspection","atomic/file-locked local writes"],"risks":["corrupt markdown state was accepted as an empty todo state in this fixture","large upstream surface and version coupling","scheduler/daemon/host integration expansion","no independent execution-provider comparison yet"],"unresolved_questions":["Can LoopX integrity checking be made fail-closed without upstream patching?","Does it remain useful with Prime Agent or another provider?","What exact pin/update/rollback contract would ABVX accept?","Is the operational value worth the upstream surface for ABVX mission volume?"]}
